MoMo là một nền tảng ví điện tử do Công ty Cổ phần Dịch vụ Di động Trực tuyến (M_Service) phát triển cho phép người dùng thực hiện các thanh toán, giao dịch trên các thiết bị di động. Bằng việc hợp tác với hơn 90% ngân hàng tại Việt Nam cùng 10.000 thương nhân trong nước, công ty này nắm giữ hơn 80% thị phần trong lĩnh vực thanh toán kỹ thuật số. Tính đến năm 2022, ví điện tử MoMo có hơn 31 triệu người dùng sử dụng. (https://vi.wikipedia.org/wiki/MoMo_(v%C3%AD_%C4%91i%E1%BB%87n_t%E1%BB%AD))
Lịch sử: Kể từ năm 2007, MoMo bắt đầu triển khai xây dựng hệ sinh thái thanh toán điện tử tương tự như  WeChat. Vào tháng 10 năm 2010, MoMo ra mắt dưới dạng dịch vụ liên kết giữa mạng điện thoại VinaPhone với các hệ thống các ngân hàng tại Việt Nam, cho phép các thuê bao di động thực hiện thanh toán, chuyển khoản ngay trên thiết bị của họ. Tất cả các dịch vụ của MoMo đều được tích hợp trong sim 128K của VinaPhone. Mỗi thuê bao sử dụng dịch vụ ví điện tử MoMo phải trả mức phí 5.000 đồng/tháng. Trong đó, người dùng phải trả thêm 200 đồng cho mỗi giao dịch riêng.

Ngày 2 tháng 6 năm 2014, MoMo cho phép người dùng tải về thông qua nền tảng Android. Không lâu sau đó, MoMo có mặt trên App Store của iOS. Tháng 4 năm 2015, ứng dụng xuất hiện trên nền tảng Windows Phone. Tháng 10 năm 2015, MoMo chính thức được Ngân hàng Nhà nước Việt Nam cấp giấy phép, đảm bảo tiền trong ví là tiền thật và được bảo chứng. Cùng thời gian này, M_Service ký thỏa thuận hợp tác với Standard Chartered cho ra mắt dịch vụ Straight2Bank Wallet, cho phép khách hàng doanh nghiệp của Standard Chartered tại Việt Nam có thể thực hiện giao dịch với mọi cá nhân thông qua ví điện tử MoMo ngay cả khi người đó chưa có tài khoản ngân hàng. Đầu năm 2016, quỹ Standard Chartered Private Equity và Goldman Sachs chi 28 triệu đô la đầu tư cho MoMo. Tháng 9 cùng năm, MoMo được trao Chứng nhận Bảo mật quốc tế PCI DSS cấp độ "nhà cung cấp dịch vụ" dành cho doanh nghiệp có các dịch vụ xử lý, truyền tải, lưu trữ dữ liệu liên quan đến thẻ thanh toán.

Tháng 4 năm 2017, MoMo là đối tác tiếp theo của CGV Cinemas. Tháng 8 năm 2017, Ngân hàng Shinhan ký thỏa thuận ghi nhớ với M_Service về việc nối số tài khoản khách hàng của Ngân hàng Shinhan với ví điện tử MoMo. Đến tháng 11, MoMo và Uber ký kết thỏa thuận hợp tác chiến lược, qua đó cho phép người dùng thanh toán trực tiếp các dịch vụ của Uber thông qua ví điện tử này, giúp Việt Nam trở thành quốc gia đầu tiên ở Đông Nam Á có thể thanh toán Uber qua ví điện tử.

Năm 2018, MoMo lần lượt ký thỏa thuận hợp tác với Tổng công ty bảo hiểm Bảo Việt,  Công ty tài chính tiêu dùng Home Credit Việt Nam và Tổng Công ty Đường Sắt Việt Nam. Năm 2019, MoMo tiếp tục thỏa thuận hợp tác với Công ty Hệ thống Thông tin FPT trong việc thanh toán qua các hệ thống quản lý bệnh viện FPT.eHospital và chính quyền điện tử FPT.eGov và ký kết các thỏa thuận với Bệnh viện Đại học Y Dược Thành phố Hồ Chí Minh cùng hệ thống siêu thị Saigon Co.op. Tháng 9 năm 2019, MoMo ra mắt tính năng thanh toán trò chơi, ứng dụng và các dịch vụ trên App Store.

Ngày 9 tháng 12 năm 2019, ví MoMo trở thành một trong bốn kênh thanh toán chính thức trên cổng dịch vụ công Việt Nam,Năm 2020, ví MoMo ký kết thỏa thuận hợp tác với Cục Tin học hóa triển khai Cổng thanh toán quốc gia. bên cạnh VNPT Pay, Vietinbank và Vietcombank. Đến tháng 9 năm 2020, ứng dụng này hoàn tất việc kết nối hạ tầng công nghệ với 38 tỉnh, thành phố có tích hợp cổng dịch vụ công quốc gia. Cùng năm, ví điện tử này ký thỏa thuận hợp tác toàn diện đồng thời triển khai kênh thanh toán chiến lược với tập đoàn bảo hiểm nhân thọ AIA.

Ngay tháng đầu tiên ra mắt, ứng dụng này có hàng trăm nghìn lượt tải về, trở thành một trong năm ứng dụng tài chính có số lượt tải cao nhất trên Google Play. Tháng 9 năm 2015, MoMo lọt vào danh sách mười ứng dụng miễn phí trên cửa hàng Apple Store Việt Nam và cũng là ứng dụng ví điện tử trên di động đầu tiên đạt mốc một triệu người dùng. Ngày 22 tháng 9 cùng tháng, ứng dụng này lọt vào top 2 ứng dụng miễn phí trên App Store Việt Nam.

Trong cuộc khảo sát do tạp chí Nhịp Cầu Đầu Tư công bố tháng 4 năm 2018, MoMo là "ví điện tử số một Việt Nam". Tháng 10 cùng năm, MoMo trở thành đại diện đầu tiên của Việt Nam có mặt trong Fintech100 và nằm trong danh sách Top 50 "Ngôi sao mới nổi". Một năm sau đó, MoMo từ thứ hạng 84 vọt lên 36, lọt vào danh sách 50 công ty dẫn đầu Fintech100.[32] Tính đến ngày 30 tháng 10 năm 2018, MoMo góp mặt trong danh sách 20 ứng dụng miễn phí của kho ứng dụng Google Play và dẫn đầu trong danh sách những ứng dụng miễn phí về tài chính. Ngoài ra, ứng dụng này còn là ứng dụng tài chính nhiều người sử dụng nhất năm 2020 do App Annie đề cử, đồng thời là một trong mười thương hiệu có "trải nghiệm khách hàng xuất sắc" do KPMG công bố. Đây cũng là thương hiệu ví điện tử đầu tiên tại Việt Nam có mặt trong danh sách này.

Hoạt động cộng đồng: Ví MoMo cùng các đối tác đã thực hiện nhiều chương trình hỗ trợ cộng đồng như vận động quyên góp hỗ trợ phẫu thuật dị tật bẩm sinh cho trẻ em, hoạt động đi bộ trực tuyến hỗ trợ quỹ học bổng "tiếp sức đến trường", hỗ trợ bệnh nhi ung thư. Ngoài ra, trong giai đoạn Đại dịch COVID-19 tại Việt Nam, ví điện tử này ra mắt video ca nhạc "Điều nhỏ bé vĩ đại" nhằm cổ vũ người dân chống dịch, đồng thời quyên góp 1 tỷ đồng cho Ủy ban Trung ương Mặt trận Tổ quốc Việt Nam.

Năm 2020, Ví MoMo ra mắt cuộc thi "học viện MoMo", tạo sân chơi học thuật, kiến thức từ nhiều lĩnh vực dưới dạng các câu hỏi đáp, thu hút 6 triệu người tham gia sau 2 tuần. Ngày 4 tháng 10, cuộc thi kết thúc với phần thưởng 1 tỷ đồng được trao cho quán quân cuộc thi.

Vinh danh: Năm 2018, MoMo nhận giải "ICT Awards" nhằm ghi nhận nỗ lực của ứng dụng này trong việc định hướng đô thị thông minh ở Thành phố Hồ Chí Minh. Năm 2019, MoMo được The Asian Banker tại Việt Nam vinh danh là "Sản phẩm ví điện tử xuất sắc nhất".

Dịch vụ: MoMo cho phép người dùng thanh toán hơn 500 dịch vụ khác nhau bao gồm hóa đơn điện, nước, internet, phí chung cư, nạp tiền điện thoại, mua vé xem phim, đặt vé máy bay, vé tàu, vé xe, đặt phòng khách sạn, mua đồ ăn, thức uống, thanh toán cà phê, đổ xăng, mua sắm cùng các dịch vụ tài chính như ngân hàng, bảo hiểm. Bên cạnh đó, ứng dụng còn tích hợp chức năng tích điểm thưởng, đổi điểm thưởng lấy voucher mua sắm, nuôi heo đất hoàn tiền hoặc quyên góp cho các hoạt động thiện nguyện. Cuối năm 2020, MoMo ra mắt tính năng "du lịch, đi lại". Ngoài ra, MoMo là ứng dụng thanh toán di động đầu tiên của Việt Nam tích hợp công nghệ "One Touch Payment", cho phép khách hàng thực hiện giao dịch thông qua một lần chạm màn hình.

Hướng dẫn kiểm tra tài khoản Ví Trả Sau trên MoMo
1. Cách kiểm tra tài khoản trả sau Ví Trả Sau 
1.1 Các bước kiểm tra hạn mức Ví Trả Sau trên MoMo
Hạn mức Ví Trả Sau là số dư khả dụng mà bạn có thể sử dụng để chi tiêu. Để có thể kiểm tra được hạn mức Ví Trả Sau của mình bao nhiêu, bạn hãy thực hiện theo các bước sau: 

Bước 1: Tại màn hình chính của MoMo, chọn mục Ví Trả Sau hoặc trên thanh tìm kiếm bạn bấm “Ví Trả Sau”; 
Bước 2: Xác thực mật khẩu;
Bước 3: Ở màn hình Ví Trả Sau, số dư khả dụng chính là hạn mức tiền bạn được sử dụng khi mở Ví Trả Sau. 
1.2  Các bước kiểm tra dư nợ Ví Trả Sau trên MoMo
Dư nợ Ví Trả Sau là những khoản tiền mà bạn đã sử dụng Ví Trả Sau để chi tiêu và cần thanh toán lại cho Ví Trả Sau khi đến hạn. Để có thể kiểm tra được dư nợ Ví Trả Sau của mình là bao nhiêu, bạn hãy thực hiện theo các bước sau;

Bước 1: Tại màn hình chính của MoMo, chọn mục Ví Trả Sau hoặc trên thanh tìm kiếm bạn bấm “Ví Trả Sau”; 
Bước 2: Xác thực mật khẩu;
Bước 3: Ở màn hình Ví Trả Sau chọn “Thanh toán dư nợ”. Tại đây, bạn sẽ thấy được dư nợ hiện tại của mình. Nếu có nhu cầu thanh toán dư nợ, bạn có thể bấm “Thanh toán ngay” đến hoàn tất thanh toán dư nợ. 
3.3  Các bước kiểm tra giao dịch Ví Trả Sau trên MoMo
Việc kiểm tra giao dịch Ví Trả Sau trên MoMo giúp bạn biết được rằng mình đã sử dụng tiền trong hạn mức để chi tiêu cho những giao dịch nào. Điều này giúp bạn có thể quản lý chặt chẽ dư nợ của mình. Để có thể kiểm tra lịch sử giao dịch của Ví Trả Sau, bạn cần thực hiện các bước sau: 

Bước 1: Tại màn hình chính của MoMo, chọn mục Ví Trả Sau hoặc trên thanh tìm kiếm bạn bấm “Ví Trả Sau”; 
Bước 2: Xác thực mật khẩu;
Bước 3: Ở màn hình Ví Trả Sau chọn “Lịch sử GD”. Tại đây, bạn sẽ thấy được những giao dịch của bạn được thực hiện thanh toán bằng nguồn tiền Ví Trả Sau. 
2. Những lưu ý giúp bạn tối ưu được quyền lợi và lợi ích khi sử dụng Ví Trả Sau 
Để tận dụng được tối đa lợi ích từ Ví Trả Sau và tránh những rủi ro không đáng có khi sử dụng, bạn cần lưu ý một số điểm quan trọng dưới đây. Hãy tập những thói quen này vì chúng sẽ giúp bạn quản lý tài chính thông minh hơn.  

2.1 Cần thanh toán dư nợ trước hạn 
Một trong những yếu tố quan trọng nhất khi sử dụng Ví Trả Sau là thanh toán dư nợ đúng hạn. Việc thanh toán không đúng hạn sẽ khiến bạn phải chịu phí trễ hạn và ảnh hưởng đến điểm tín dụng cá nhân dẫn đến khó có khả năng vay mượn trong tương lai. Để tránh tình trạng này, bạn cần phải:

Kiểm tra tài khoản trả sau đều đặn để biết rõ dư nợ và hạn thanh toán.
Cài đặt thông báo nhắc nhở trên Ứng dụng MoMo để nhận thông báo khi gần đến ngày tới hạn thanh toán dư nợ.
2.2 Theo dõi dư nợ và thường xuyên kiểm tra lịch sử giao dịch 
Việc kiểm tra thường xuyên lịch sử giao dịch giúp bạn nắm bắt được tình hình tài chính của mình. Đừng để dư nợ tồn đọng quá nhiều mà không nhận ra bằng cách: 

Kiểm tra dư nợ Ví Trả Sau trên MoMo: Hãy kiểm tra số tiền đã chi tiêu và khoản nợ cần thanh toán để luôn chủ động trong việc trả tiền đúng hạn.
Kiểm tra giao dịch Ví Trả Sau trên MoMo: Xem lại các giao dịch để đảm bảo rằng không có khoản chi tiêu nào không đúng hoặc bị sai sót. Điều này cũng giúp bạn phát hiện các giao dịch gian lận nếu có xảy ra.
2.3 Chỉ sử dụng Ví Trả Sau trong khả năng có thể chi trả được của bản thân 
Dù Ví Trả Sau giúp bạn chi tiêu trước, trả tiền sau nhưng bạn cũng cần có kế hoạch trả nợ rõ ràng. Nếu bạn sử dụng hết hạn mức tín dụng mà không có khả năng thanh toán đúng hạn, bạn có thể rơi vào vòng xoáy nợ nần khó thoát ra. Chính vì thế bạn nên: 

Quản lý chi tiêu hợp lý: Đừng chi tiêu vượt quá khả năng trả nợ của mình. 
Lên kế hoạch trả nợ: Nếu bạn có dư nợ, hãy lên kế hoạch trả dần theo khả năng tài chính của mình. Đừng để nợ bị tích lũy quá lâu, vì phí trễ hạn sẽ làm tăng số tiền phải trả.
2.4 Bật tính năng thông báo, nhắc nhở trả dư nợ Ví trả Sau hoặc trả dư nợ tối thiểu  
Một trong những tính năng hữu ích mà Ví Trả Sau cung cấp là các thông báo nhắc nhở về hạn thanh toán. Bên cạnh đó, bạn cũng nên tận dụng tính năng Tự động thanh toán dư nợ tối thiểu để tránh chịu thêm phí phạt nếu quá hạn. Kiểm tra thường xuyên các thông báo: Hãy chắc chắn rằng bạn thường xuyên kiểm tra Ví Trả Sau trên MoMo vì điều này sẽ giúp bạn quản lý tài chính và tránh các vấn đề phát sinh ngoài ý muốn.

2.5 Đọc kĩ các chính sách và điều khoản trước khi sử dụng Ví Trả Sau 
Trước khi sử dụng Ví Trả Sau, hãy chắc chắn rằng bạn đã hiểu rõ các điều khoản về tín dụng, phí trễ hạn, và các quy định liên quan. Ví Trả Sau có thể thay đổi các điều kiện này, vì vậy việc cập nhật thông tin và đọc kỹ các thông báo về chính sách là rất quan trọng. 

3. Giới thiệu Ví Trả Sau của MoMo
Ví Trả Sau là hình thức thanh toán sử dụng hạn mức tín dụng được cấp trước để chi tiêu và người dùng cần hoàn trả theo kỳ hạn quy định của nhà cung cấp dịch vụ. Ứng dụng MoMo là giải pháp công nghệ và trung gian thanh toán cho các tổ chức tín dụng cung cấp sản phẩm Ví Trả Sau.

Khi kích hoạt Ví Trả Sau thành công trên MoMo, khách hàng sẽ được cấp một hạn mức tín dụng ngay tức thì để chi tiêu cho các dịch vụ trên MoMo và tại một số điểm chấp nhận thanh toán. Với hạn mức chi tiêu được cấp tại Ví Trả Sau, bạn có thể lựa chọn sử dụng qua 2 cách khác nhau:

Mua sắm trả sau (Mua sắm tháng này, trả vào tháng sau);
Mua sắm trả góp (Mua sắm tháng này, phân chia dư nợ để trả trong nhiều kỳ). 

4. Tại sao bạn nên sử dụng Ví Trả Sau?  
Dễ tiếp cận, dễ đăng ký: Với mong muốn ai cũng có thể tiếp cận hình thức “Mua trước - Trả sau”, Ví Trả Sau đã nỗ lực đơn giản hóa quy trình giúp bạn đăng ký trên điện thoại một cách dễ dàng và nhanh chóng. Chỉ cần bạn có MoMo đã xác thực tài khoản (KYC) và liên kết tài khoản ngân hàng thành công, Ví Trả Sau có thể duyệt hồ sơ của bạn và cấp hạn mức chi tiêu cho bạn tức thì.

Thanh toán tiện lợi: Khi đã kích hoạt Ví Trả Sau thành công, bạn có thể thanh toán hàng ngàn dịch vụ trên MoMo: nạp tiền điện thoại, thanh toán hóa đơn (điện, nước, Internet, chung cư, trường học,…), đặt vé (máy bay, tàu, xe), gọi món (Shopee Food, Be Food,...), mua sắm, đi chợ online,… Đặc biệt, bạn có thể chuyển đổi trả góp tất cả dư nợ của mình với các kỳ hạn. Đây là ưu điểm mà không phải dịch vụ trả sau nào cũng đáp ứng được.

Chi phí minh bạch, rõ ràng: Với mục tiêu hỗ trợ tốt nhất những khách hàng cần giải quyết vấn đề tài chính, Ví Trả Sau hoạt động với tiêu chí công khai minh bạch, rõ ràng tất cả các khoản phí để đảm bảo quyền lợi cho khách hàng. Bạn không phải lo lắng khi sử dụng Ví Trả Sau vì dịch vụ không có bất kỳ một khoản phí ẩn nào. Ngoài ra, giao diện tối ưu, hiện đại của Ví Trả Sau cũng giúp bạn dễ dàng theo dõi hạn mức, ưu đãi và các loại phí cần trả khi đến kỳ hạn thanh toán.

4 tính năng chính của ứng dụng Ví MoMo: Hoàn tiền khi thanh toán, Mua mã thẻ “siêu” tiết kiệm, Chuyển và nhận tiền ngay lập tức, Bảo mật hơn với mã OTP

4 tính năng chính của ứng dụng Ví MoMo:
- Hoàn tiền khi thanh toán: Ứng dụng MoMo thu hút nhiều người sử dụng nhờ vào tính năng hoàn tiền khi thanh toán, với MoMo mỗi lần thanh toán sẽ được chiết khấu một phần tiền tuỳ vào chương trình. Số tiền đó sẽ được đưa vào “Heo” để tích luỹ và có thể rút khi cần.
- Mua mã thẻ “siêu” tiết kiệm: Bạn hoàn toàn có thể mua mã thẻ hoặc nạp tiền điện thoại trực tiếp thông qua MoMo với giá ưu đãi. Với tính năng tiện ích này bạn hoàn toàn có thể nạp tiền cho bạn bè và người thân một cách dễ dàng. 
- Chuyển và nhận tiền ngay lập tức: Với MoMo bạn có thể chuyển tiền cho bất kì ai thông qua số điện thoại được đăng ký khi kích hoạt tài khoản. Chuyển tiền nhanh ngay tích tắc, bạn hoàn toàn có thể rút về thẻ ngay sau đó.
- Bảo mật hơn với mã OTP: Ngoài tính năng mở ứng dụng bằng vân tay thì mỗi lần đăng nhập mới trên thiết bị, ứng dụng sẽ gửi mã OTP xác thực một lần nữa, giúp bạn bảo vệ tài khoản tốt hơn. Với những ưu điểm trên của MoMo, bạn đã sẵn sàng tải và trải nghiệm ứng dụng chưa? hãy để lại bình luận ở phía bên dưới để cùng bàn về ứng dụng nhé.

I. Đăng nhập Momo bằng web và máy tính được không?
Theo thông tin từ website của Momo, hiện tại ứng dụng ví điện tử Momo chưa hỗ trợ người dùng đăng nhập bằng web. Để đăng nhập vào tài khoản Momo, người dùng cần phải tải ứng dụng Momo trên điện thoại và đăng nhập bằng số điện thoại và mật khẩu.

Mặc dù ứng dụng ví điện tử Momo không hỗ trợ đăng nhập trực tiếp trên website. Tuy nhiên, bạn có thể cài đặt giả lập Android trên máy tính và tải ứng dụng Momo trên giả lập để đăng nhập và sử dụng. Khi đăng nhập, bạn có thể sử dụng hầu hết các tính năng và dịch vụ của Momo trực tiếp trên phần mềm giả lập.

Một số phần mềm giả lập Android phổ biến bạn có thể cài để sử dụng MoMo như BlueStacks, NoxPlayer, MEmu Play,...

II. Cách đăng nhập MoMo trên máy tính
1. Hướng dẫn nhanh
Cài đặt ứng dụng BlueStacks > Chọn vào Play Store > Đăng nhập tài khoản Google > Tìm từ khoá MoMo trên Play Store > Cài đặt ứng dụng MoMo > Mở ứng dụng MoMo > Đăng nhập tài khoản MoMo để sử dụng.

2. Hướng dẫn chi tiết
Bước 1: Đầu tiên, bạn cần tải và cài đặt giả lập Android với với BlueStacks trên máy tính của mình. Ở màn hình giao diện của BlueStacks, bạn chọn vào ứng dụng Play Store
Bước 2: Tại lần sử dụng đầu tiên sẽ yêu cầu các bạn đăng nhập tài khoản Google (Gmail). Bạn bấm vào mục Sign in để bắt đầu đăng nhập tài khoản của mình vào Play Store.
Bước 3: Ở màn hình Play Store, bạn tiến hành nhập từ khoá "MoMo" vào hộp tìm kiếm và bấm vào Install để tải ứng dụng về thiết bị.
Bước 4: Sau quá trình cài đặt Momo hoàn thành, ở màn hình giao diện của BlueStacks bạn chọn vào ứng dụng MoMo trên màn hình.
Bước 5: Ở trong giao diện của Momo trên máy tính, bạn nhập số điện thoại đã đăng ký trước vào và nhấn Tiếp tục. Sau đó, bạn tiến hành nhập mật khẩu tài khoản MoMo của mình là có thể đăng nhập sử dụng MoMo bình thường trên máy tính của mình.

III. Hạn chế của các tính năng MoMo khi đăng nhập trên máy tính
Không thể thực hiện các giao dịch bằng xác thực bằng khuôn mặt hoặc vân tay: Hiện nay, tính năng xác thực bằng khuôn mặt hoặc vân tay chỉ khả dụng trên ứng dụng MoMo dành cho điện thoại di động. Khi đăng nhập trên máy tính, người dùng sẽ phải sử dụng phương thức xác thực truyền thống như nhập mã OTP hoặc mật khẩu.
Không thể sử dụng các tính năng quét mã QR Code của ứng dụng MoMo: Tính năng quét mã QR Code hiện chỉ chỉ khả dụng trên ứng dụng MoMo dành cho điện thoại di động. Khi đăng nhập trên máy tính, người dùng chỉ có thể thực hiện các giao dịch bằng cách nhập thông tin thanh toán thủ công.
Yêu cầu kết nối internet ổn định: Do sử dụng phần mềm giả lập Android trên máy tính vì vậy khi sử dụng MoMo người dùng cần đảm bảo có kết nối internet ổn định để thực hiện các giao dịch. Nếu kết nối internet bị ngắt, người dùng sẽ không thể thực hiện các giao dịch trên MoMo.
Hiện tượng giật lag có thể thường xuyên xảy ra: Khi sử dụng MoMo trên máy tính, người dùng có thể gặp phải hiện tượng giật lag. Nguyên nhân là do phần mềm giả lập Android, được sử dụng để chạy ứng dụng MoMo trên máy tính, có thể gây ra hiện tượng này.

1. Ví MoMo là gì? MoMo là ứng dụng Ví điện tử trên điện thoại thông minh đã có mặt trên 2 hệ điều hành iOS và Android với hơn 10 triệu người dùng, là dịch vụ chính của Công ty Cổ phần Dịch vụ Di Động Trực tuyến (viết tắt M_Service) được thành lập từ 2007.
Ví điện tử MoMo cho phép bạn tạo và nạp tiền vào tài khoản MoMo để thanh toán cho hơn 200 dịch vụ như nạp tiền điện thoại, thanh toán điện nước, thanh toán vay tiêu dùng,...

2. Các tính năng của Ví MoMo:
Một số tính năng hữu ích khi sử dụng Ví điện tử MoMo:
- Thanh toán hóa đơn, dịch vụ nhanh chóng, tiện lợi: ví MoMo cho phép người sử dụng dễ dàng thanh toán các dịch vụ cần thiết trong đời sống hằng ngày như các loại hóa đơn tiền điện, tiền nước, internet, truyền hình cáp, bảo hiểm, thanh toán vé máy bay, tàu xe,...
Dễ dàng đặt vé xem phim của tất cả các cụm rạp CGV Cinemas, Lotte Cinema, Galaxy Cinema, BHD Star Cineplex, Cinestar, Mega GS, DCine với giá vé cực lời.
- Thanh toán các khoản vay tiêu dùng cá nhân và bảo hiểm: ví MoMo còn cho phép thanh toán khoản vay trả chậm tại các công ty tài chính như Fe Credit, Home Credit, Shinhan Finance,... ngay trên điện thoại di động mà không cần đến các địa điểm thanh toán.
- Quét mã QR và thanh toán khi mua sắm dễ dàng: Ví MoMo còn có khả năng thanh toán bằng cách quét mã QR khi mua sắm tại các chuỗi cửa hàng tiện lợi, siêu thị như Circle K, Ministop, Family Mart,... và các chuỗi ăn uống The Coffee House, Phúc Long, King BBQ,... và hàng loạt chuỗi cửa hàng khác.
- Tự động nhắc nhở người dùng thanh toán hóa đơn khi đến thời hạn: Ngoài ra, ví MoMo còn sở hữu tính năng tự động nhắc nhở người dùng thanh toán hóa đơn mỗi khi tới kỳ thanh toán, đồng thời ứng dụng cũng cho phép liệt kê lịch sử giao dịch và thống kê chi tiêu giúp người dùng dễ quản lý chi tiêu.
- Chuyển tiền, nhận tiền nhanh chóng: Chuyển tiền đến Ví MoMo hoàn toàn miễn phí, chỉ cần số điện thoại người nhận; miễn phí rút tiền về ngân hàng liên kết. Chuyển tiền đến 45 ngân hàng nội địa tiện lợi, nhanh chóng, hoàn toàn bảo mật; nhận tiền tức thì, 24/7 (bao gồm cả cuối tuần và ngày lễ).
- Mua thẻ điện thoại, thẻ game dễ dàng: Bạn có thể nạp tiền điện thoại tất cả các nhà mạng trên MoMo như: Viettel, Mobifone, Vinaphone, Vietnamobile, Gmobile dễ dàng và nhanh chóng mà còn được hưởng chiết khấu sau mỗi giao dịch thành công. Ngoài ra, người dùng còn có thể mua thẻ game của các nhà phát hành với chính sách khuyến mãi phong phú.
